{
  "packVersion": "1.0",
  "packId": "holy-sai-stage6-maths-numbers",
  "source": {
    "school": "Holy Sai International School",
    "book": "Maths Worksheet Book 26-27",
    "capturedAs": "parent photo upload",
    "photoCount": 11,
    "extractedOn": "2026-08-23",
    "confidence": "high",
    "reviewNotes": "Worksheet 3 diagrams were not legible in the photographs and were rebuilt from the stated counts. Flagged with media.redrawn."
  },
  "curriculum": {
    "board": "Cambridge",
    "stage": "Stage 6 / IGCSE lower secondary",
    "subject": "Mathematics",
    "strand": "Numbers and Calculations"
  },
  "language": "en",
  "contents": [
    {
      "no": 1,
      "topic": "Numbers and Calculations",
      "objective": "To count on and count back (including negative numbers)",
      "page": 4,
      "sheetId": "ws1"
    },
    {
      "no": 2,
      "topic": "Numbers and Calculations",
      "objective": "To find any term of a linear sequence",
      "page": 6,
      "sheetId": "ws2"
    },
    {
      "no": 3,
      "topic": "Numbers and Calculations",
      "objective": "To extend the spatial pattern of square and triangular numbers",
      "page": 7,
      "sheetId": "ws3"
    },
    {
      "no": 4,
      "topic": "Numbers and Calculations",
      "objective": "To find square and triangular numbers",
      "page": 8,
      "sheetId": "ws4"
    },
    {
      "no": 5,
      "topic": "Numbers and Calculations",
      "objective": "To find the difference between prime and composite numbers",
      "page": 9,
      "sheetId": "ws5"
    },
    {
      "no": 6,
      "topic": "Numbers and Calculations",
      "objective": "To solve problems using arithmetic operations",
      "page": 11,
      "sheetId": "ws6"
    },
    {
      "no": 7,
      "topic": "Numbers and Calculations",
      "objective": "To add and subtract integers",
      "page": 15,
      "sheetId": null
    },
    {
      "no": 8,
      "topic": "Numbers and Calculations",
      "objective": "To identify the values of unknown symbols",
      "page": 16,
      "sheetId": null
    },
    {
      "no": 9,
      "topic": "Numbers and Calculations",
      "objective": "To use laws of arithmetic and order of operations",
      "page": 18,
      "sheetId": null
    },
    {
      "no": 10,
      "topic": "Fractions, decimals, percentages and proportion",
      "objective": "To compose, decompose, regroup and round off decimals",
      "page": 20,
      "sheetId": null
    },
    {
      "no": 11,
      "topic": "Fractions, decimals, percentages and proportion",
      "objective": "To multiply and divide decimals by 10, 100 and 1000",
      "page": 22,
      "sheetId": null
    },
    {
      "no": 12,
      "topic": "Fractions, decimals, percentages and proportion",
      "objective": "To do arithmetic operations in decimals",
      "page": 23,
      "sheetId": null
    },
    {
      "no": 13,
      "topic": "Fractions, decimals, percentages and proportion",
      "objective": "Equivalent fractions, comparing, mixed numbers and improper fractions",
      "page": 26,
      "sheetId": null
    },
    {
      "no": 14,
      "topic": "Fractions, decimals, percentages and proportion",
      "objective": "Percentage of shapes, fraction–decimal–percentage equivalence, ratio and proportion",
      "page": 31,
      "sheetId": null
    },
    {
      "no": 15,
      "topic": "Time",
      "objective": "Time intervals in seconds, minutes and hours; time zones",
      "page": 35,
      "sheetId": null
    },
    {
      "no": 16,
      "topic": "Angles and shapes",
      "objective": "Identify, describe and sketch 3 types of triangles and symmetry",
      "page": 39,
      "sheetId": null
    },
    {
      "no": 17,
      "topic": "Angles and shapes",
      "objective": "Identify, describe and sketch 3D shapes; nets of a cube",
      "page": 42,
      "sheetId": null
    },
    {
      "no": 18,
      "topic": "Angles and shapes",
      "objective": "Compare and classify angles; missing angles on a straight line",
      "page": 44,
      "sheetId": null
    },
    {
      "no": 19,
      "topic": "Angles and shapes",
      "objective": "Estimate and measure area and perimeter of 2D shapes",
      "page": 47,
      "sheetId": null
    },
    {
      "no": 20,
      "topic": "Location and Movement",
      "objective": "Plot coordinates; translate and reflect 2D shapes",
      "page": 50,
      "sheetId": null
    },
    {
      "no": 21,
      "topic": "Statistical Methods",
      "objective": "Represent categorical, discrete and continuous data in graphs and charts",
      "page": 52,
      "sheetId": null
    },
    {
      "no": 22,
      "topic": "Statistical Methods",
      "objective": "Find the mode and median for a given set of data",
      "page": 57,
      "sheetId": null
    },
    {
      "no": 23,
      "topic": "Probability",
      "objective": "Describe results using the language of probability",
      "page": 59,
      "sheetId": null
    }
  ],
  "sheets": [
    {
      "id": "ws1",
      "no": 1,
      "title": "Count on and count back",
      "objective": "Counting on and back in steps, including through zero into negative numbers.",
      "page": "4–5",
      "date": "2 / 7 / 26",
      "skill": "counting-on-back-negatives",
      "strategy": {
        "title": "The jump trick",
        "body": "To find a step size when you can see the first and last number: (last − first) ÷ number of jumps. From 213 to 245 there are 4 jumps, and 32 ÷ 4 = 8. Now you never have to guess."
      },
      "reviewNote": null,
      "questions": [
        {
          "id": "ws1-q0",
          "label": "1a",
          "prompt": "Count on and write the steps.",
          "sub": "213, ___ , ___ , ___ , 245",
          "layout": "stack",
          "media": null,
          "table": null,
          "fields": [
            {
              "key": "a",
              "label": "The three missing numbers",
              "placeholder": "e.g. 221, 229, 237",
              "width": "md",
              "input": "text",
              "options": null,
              "inTable": false,
              "check": {
                "kind": "sequence",
                "values": [
                  221,
                  229,
                  237
                ]
              },
              "answerText": null
            }
          ],
          "hint": "Four jumps take you from 213 to 245. How big is one jump?",
          "explanation": "245 − 213 = 32, and there are 4 jumps, so each step is 32 ÷ 4 = 8. Counting on in 8s: 213 → 221 → 229 → 237 → 245.",
          "needsHuman": false
        },
        {
          "id": "ws1-q1",
          "label": "1b",
          "prompt": "Count on and write the steps.",
          "sub": "−477, ___ , ___ , −456, ___",
          "layout": "stack",
          "media": null,
          "table": null,
          "fields": [
            {
              "key": "a",
              "label": "The three missing numbers",
              "placeholder": "e.g. -470, -463, -449",
              "width": "md",
              "input": "text",
              "options": null,
              "inTable": false,
              "check": {
                "kind": "sequence",
                "values": [
                  -470,
                  -463,
                  -449
                ],
                "gapped": true
              },
              "answerText": null
            }
          ],
          "hint": "Careful — with negatives, counting ON means moving towards zero, so the numbers get bigger (−477 → −470).",
          "explanation": "From −477 to −456 is 21 in 3 jumps, so each step is +7. The sequence is −477 → −470 → −463 → −456 → −449.",
          "needsHuman": false
        },
        {
          "id": "ws1-q2",
          "label": "2",
          "prompt": "Count on 8 from 156 and write the first five numbers of the sequence.",
          "sub": null,
          "layout": "stack",
          "media": null,
          "table": null,
          "fields": [
            {
              "key": "a",
              "label": "First five numbers",
              "placeholder": "e.g. 164, 172, ...",
              "width": "lg",
              "input": "text",
              "options": null,
              "inTable": false,
              "check": {
                "kind": "sequence",
                "values": [
                  164,
                  172,
                  180,
                  188,
                  196
                ]
              },
              "answerText": null
            }
          ],
          "hint": "The first number of the sequence is 156 + 8, not 156 itself.",
          "explanation": "Starting at 156 and adding 8 each time: 164, 172, 180, 188, 196.",
          "needsHuman": false
        },
        {
          "id": "ws1-q3",
          "label": "3a",
          "prompt": "Count back in 4s from 10 and write the sequence.",
          "sub": "Use a number line from −10 to 10 to help.",
          "layout": "stack",
          "media": null,
          "table": null,
          "fields": [
            {
              "key": "a",
              "label": "Sequence down to −10",
              "placeholder": "e.g. 10, 6, 2, ...",
              "width": "lg",
              "input": "text",
              "options": null,
              "inTable": false,
              "check": {
                "kind": "sequence",
                "values": [
                  10,
                  6,
                  2,
                  -2,
                  -6,
                  -10
                ]
              },
              "answerText": null
            }
          ],
          "hint": "Counting back doesn't stop at zero. After 2, the next jump of 4 lands you at −2.",
          "explanation": "10 → 6 → 2 → −2 → −6 → −10. Zero is just another number on the line; the step size never changes as you cross it.",
          "needsHuman": false
        },
        {